<?xml version="1.0" encoding="UTF-8"?>
<tns:mapper author="CCH" id="dummyMap" organization="org"
	version="TEST" xmlns:tns="http://ehrserver.ethercis.com/servicemap"
	xmlns:xsi="http://www.w3.org/2001/XMLSchema-instance"
	xsi:schemaLocation="http://ehrserver.ethercis.com/servicemap schemas/servicemap.xsd ">
	<tns:action category="GET">
		<tns:service>
			<tns:resource>DummyTestService</tns:resource>
			<tns:path>dummy</tns:path>
			<tns:serviceid>DUMMY</tns:serviceid>
			<tns:serviceversion>1.0</tns:serviceversion>
			<tns:method>
				<tns:name>get</tns:name>
				<tns:implementation>method1</tns:implementation>
				<tns:return>Base64</tns:return>
			</tns:method>
			<tns:method>
				<tns:name>post</tns:name>
				<tns:implementation>method2</tns:implementation>
				<tns:return>Json</tns:return>
			</tns:method>
			<tns:method async="true">
				<tns:name>execute</tns:name>
				<tns:implementation>method3</tns:implementation>
				<tns:return>Html</tns:return>
			</tns:method>
			<tns:method>
				<tns:name>read</tns:name>
				<tns:implementation>method4</tns:implementation>
				<tns:return>Xml</tns:return>
				<tns:parameters>
					<tns:class>java.lang.String</tns:class>
					<tns:class>java.lang.Integer</tns:class>
					<tns:class>java.lang.Long</tns:class>
				</tns:parameters>
			</tns:method>
			<tns:method>
				<tns:name>ping</tns:name>
				<tns:implementation>method5</tns:implementation>
				<tns:return>Xml</tns:return>
				<tns:parameters>
					<tns:class>com.ethercis.servicemanager.common.SessionClientProperties</tns:class>
				</tns:parameters>
			</tns:method>
		</tns:service>
		<tns:service>
			<tns:resource>LogonService</tns:resource>
			<tns:path>vehr</tns:path>
			<tns:serviceid>LogonService</tns:serviceid>
			<tns:serviceversion>1.0</tns:serviceversion>
			<tns:method>
				<tns:name>connect</tns:name>
				<tns:implementation>connect</tns:implementation>
				<tns:return>Property</tns:return>
			</tns:method>
			<tns:method>
				<tns:name>disconnect</tns:name>
				<tns:implementation>disconnect</tns:implementation>
				<tns:return>Void</tns:return>
			</tns:method>
		</tns:service>
		<tns:service>
			<tns:resource>__sys__MapOnly</tns:resource>
			<tns:path>vehr/policy</tns:path>
			<tns:method>
				<tns:name>get</tns:name>
				<tns:return>Void</tns:return>
			</tns:method>
			<tns:method>
				<tns:name>exist</tns:name>
				<tns:return>String</tns:return>
			</tns:method>
			<tns:method>
				<tns:name>view</tns:name>
				<tns:return>XmlArray</tns:return>
			</tns:method>
			<tns:method>
				<tns:name>execute</tns:name>
				<tns:return>Void</tns:return>
			</tns:method>
		</tns:service>
	</tns:action>
	<tns:action category="POST">
		<tns:service>
			<tns:resource>__sys__MapOnly</tns:resource>
			<tns:path>vehr/policy</tns:path>
			<tns:method>
				<tns:name>change</tns:name>
				<tns:return>XmlArray</tns:return>
			</tns:method>
			<tns:method>
				<tns:name>extend</tns:name>
				<tns:return>XmlArray</tns:return>
			</tns:method>
		</tns:service>
		<tns:service>
			<tns:resource>DummyTestService</tns:resource>
			<tns:path>dummy</tns:path>
			<tns:serviceid>DUMMY</tns:serviceid>
			<tns:serviceversion>1.0</tns:serviceversion>
			<tns:method>
				<tns:name>post</tns:name>
				<tns:implementation>method2</tns:implementation>
				<tns:return>Json</tns:return>
			</tns:method>
		</tns:service>
	</tns:action>
	<tns:action category="DELETE">
		<tns:service>
			<tns:resource>DummyTestService</tns:resource>
			<tns:path>dummy</tns:path>
			<tns:serviceid>DUMMY</tns:serviceid>
			<tns:serviceversion>1.0</tns:serviceversion>
			<tns:method>
				<tns:name>post</tns:name>
				<tns:implementation>method2</tns:implementation>
				<tns:return>Json</tns:return>
			</tns:method>
		</tns:service>
	</tns:action>
	<tns:action category="PUT">
		<tns:service>
			<tns:resource>DummyTestService</tns:resource>
			<tns:path>dummy</tns:path>
			<tns:serviceid>DUMMY</tns:serviceid>
			<tns:serviceversion>1.0</tns:serviceversion>
			<tns:method>
				<tns:name>post</tns:name>
				<tns:implementation>method2</tns:implementation>
				<tns:return>Json</tns:return>
			</tns:method>
		</tns:service>
	</tns:action>
</tns:mapper>
